{
  "schema_version": 1,
  "checklist_id": "EXAMPLE_ONLY_PREREQUISITES",
  "example_only": true,
  "profile_ref": "EXAMPLE_ONLY.vehicle-profile.json",
  "evidence_index": "../evidence/EXAMPLE_ONLY.evidence-index.json",
  "updated_at": "2000-01-01T00:00:00Z",
  "items": {
    "exact_cas_identification": {"status": "UNKNOWN", "evidence_refs": [], "updated_at": "2000-01-01T00:00:00Z", "notes": null, "blocker_reason": null},
    "exact_dde_identification": {"status": "UNKNOWN", "evidence_refs": [], "updated_at": "2000-01-01T00:00:00Z", "notes": null, "blocker_reason": null},
    "exact_egs_identification": {"status": "UNKNOWN", "evidence_refs": [], "updated_at": "2000-01-01T00:00:00Z", "notes": null, "blocker_reason": null},
    "oem_start_architecture": {"status": "UNKNOWN", "evidence_refs": [], "updated_at": "2000-01-01T00:00:00Z", "notes": null, "blocker_reason": null},
    "kl15": {"status": "UNKNOWN", "evidence_refs": [], "updated_at": "2000-01-01T00:00:00Z", "notes": null, "blocker_reason": null},
    "kl50": {"status": "UNKNOWN", "evidence_refs": [], "updated_at": "2000-01-01T00:00:00Z", "notes": null, "blocker_reason": null},
    "engine_speed": {"status": "UNKNOWN", "evidence_refs": [], "updated_at": "2000-01-01T00:00:00Z", "notes": null, "blocker_reason": null},
    "engine_running_state": {"status": "UNKNOWN", "evidence_refs": [], "updated_at": "2000-01-01T00:00:00Z", "notes": null, "blocker_reason": null},
    "stopped_cranking_running_observations": {"status": "UNKNOWN", "evidence_refs": [], "updated_at": "2000-01-01T00:00:00Z", "notes": null, "blocker_reason": null},
    "transmission_pn": {"status": "UNKNOWN", "evidence_refs": [], "updated_at": "2000-01-01T00:00:00Z", "notes": null, "blocker_reason": null},
    "transmission_prnd_tool32": {"status": "UNKNOWN", "evidence_refs": [], "updated_at": "2000-01-01T00:00:00Z", "notes": null, "blocker_reason": null},
    "brake": {"status": "UNKNOWN", "evidence_refs": [], "updated_at": "2000-01-01T00:00:00Z", "notes": null, "blocker_reason": null},
    "engine_running_detection_algorithm": {"status": "UNKNOWN", "evidence_refs": [], "updated_at": "2000-01-01T00:00:00Z", "notes": null, "blocker_reason": null},
    "terminal_50_start_request": {"status": "UNKNOWN", "evidence_refs": [], "updated_at": "2000-01-01T00:00:00Z", "notes": null, "blocker_reason": null},
    "cas_start_button_request": {"status": "UNKNOWN", "evidence_refs": [], "updated_at": "2000-01-01T00:00:00Z", "notes": null, "blocker_reason": null},
    "oem_start_request_source": {"status": "UNKNOWN", "evidence_refs": [], "updated_at": "2000-01-01T00:00:00Z", "notes": null, "blocker_reason": null},
    "remote_start_actuation_mechanism": {"status": "UNKNOWN", "evidence_refs": [], "updated_at": "2000-01-01T00:00:00Z", "notes": null, "blocker_reason": null},
    "msa_start_correlated_bits": {"status": "UNKNOWN", "evidence_refs": [], "updated_at": "2000-01-01T00:00:00Z", "notes": null, "blocker_reason": null},
    "msa_bit_functional_meaning": {"status": "UNKNOWN", "evidence_refs": [], "updated_at": "2000-01-01T00:00:00Z", "notes": null, "blocker_reason": null},
    "oem_start_authorization": {"status": "UNKNOWN", "evidence_refs": [], "updated_at": "2000-01-01T00:00:00Z", "notes": null, "blocker_reason": null},
    "battery_voltage": {"status": "UNKNOWN", "evidence_refs": [], "updated_at": "2000-01-01T00:00:00Z", "notes": null, "blocker_reason": null},
    "timeout_strategy": {"status": "UNKNOWN", "evidence_refs": [], "updated_at": "2000-01-01T00:00:00Z", "notes": null, "blocker_reason": null},
    "stop_strategy": {"status": "UNKNOWN", "evidence_refs": [], "updated_at": "2000-01-01T00:00:00Z", "notes": null, "blocker_reason": null},
    "communication_loss": {"status": "UNKNOWN", "evidence_refs": [], "updated_at": "2000-01-01T00:00:00Z", "notes": null, "blocker_reason": null},
    "post_reset_behavior": {"status": "UNKNOWN", "evidence_refs": [], "updated_at": "2000-01-01T00:00:00Z", "notes": null, "blocker_reason": null},
    "start_inhibit_conditions": {"status": "UNKNOWN", "evidence_refs": [], "updated_at": "2000-01-01T00:00:00Z", "notes": null, "blocker_reason": null},
    "can_identifiers": {"status": "UNKNOWN", "evidence_refs": [], "updated_at": "2000-01-01T00:00:00Z", "notes": "No BMW CAN identifier is present in the example.", "blocker_reason": null}
  }
}
